[
  {
    "slug": "jfk",
    "code_iata": "JFK",
    "code_icao": "KJFK",
    "name": "John F. Kennedy International Airport",
    "city_slug": "new-york",
    "country_code": "US",
    "country_name": "United States",
    "latitude": 40.6413,
    "longitude": -73.7781,
    "timezone": "America/New_York",
    "airport_type": "commercial",
    "terminal_count": 6,
    "premium_summary": "JFK is one of the most important premium long-haul gateways in North America, with strong lounge depth, transatlantic connectivity, and multiple flagship business-class departures.",
    "featured_image": "/assets/images/jfk-airport.jpg",
    "related_lounge_slugs": [
      "centurion-lounge-jfk",
      "delta-sky-club-jfk"
    ],
    "related_route_slugs": [
      "jfk-to-lhr-business-class",
      "jfk-to-dxb-business-class"
    ],
    "related_airline_slugs": [
      "delta-one",
      "emirates-business-class",
      "british-airways-business-class"
    ],
    "internal_notes": null
  }
]